{
  "backendStatus": "available",
  "diagnostics": {
    "providerId": "dev.deckr.clock"
  },
  "profile": "dev.deckr.action_runtime.provider.advertisement.v1",
  "serviceEndpoint": "service:action-runtime.clock-main",
  "serviceId": "action-runtime.clock-main",
  "serviceNamespace": "dev.deckr.action_runtime.provider",
  "serviceUseProfile": "dev.deckr.action_runtime.provider.service_use.v1",
  "sessionId": "service-session",
  "supportedMessages": {
    "action_instance_created": {
      "direction": "consumer_to_service",
      "exchangePattern": "one_way",
      "intent": "event",
      "operation": "action_instance_created"
    },
    "action_instance_destroyed": {
      "direction": "consumer_to_service",
      "exchangePattern": "one_way",
      "intent": "event",
      "operation": "action_instance_destroyed"
    },
    "action_lifecycle_rejected": {
      "direction": "service_to_consumer",
      "exchangePattern": "one_way",
      "intent": "event",
      "operation": "action_lifecycle_rejected"
    },
    "binding_attached": {
      "direction": "consumer_to_service",
      "exchangePattern": "one_way",
      "intent": "event",
      "operation": "binding_attached"
    },
    "binding_detached": {
      "direction": "consumer_to_service",
      "exchangePattern": "one_way",
      "intent": "event",
      "operation": "binding_detached"
    },
    "binding_output": {
      "direction": "service_to_consumer",
      "exchangePattern": "one_way",
      "intent": "command",
      "operation": "binding_output"
    },
    "binding_overlay": {
      "direction": "service_to_consumer",
      "exchangePattern": "one_way",
      "intent": "command",
      "operation": "binding_overlay"
    },
    "binding_overlay_clear": {
      "direction": "service_to_consumer",
      "exchangePattern": "one_way",
      "intent": "command",
      "operation": "binding_overlay_clear"
    },
    "capability_input": {
      "direction": "consumer_to_service",
      "exchangePattern": "one_way",
      "intent": "event",
      "operation": "capability_input"
    },
    "close_page": {
      "direction": "service_to_consumer",
      "exchangePattern": "one_way",
      "intent": "command",
      "operation": "close_page"
    },
    "open_page": {
      "direction": "service_to_consumer",
      "exchangePattern": "one_way",
      "intent": "command",
      "operation": "open_page"
    },
    "page_session_closed": {
      "direction": "consumer_to_service",
      "exchangePattern": "one_way",
      "intent": "event",
      "operation": "page_session_closed"
    },
    "page_session_opened": {
      "direction": "consumer_to_service",
      "exchangePattern": "one_way",
      "intent": "event",
      "operation": "page_session_opened"
    },
    "replace_page": {
      "direction": "service_to_consumer",
      "exchangePattern": "one_way",
      "intent": "command",
      "operation": "replace_page"
    }
  },
  "supportedOperations": [
    "action_instance_created",
    "action_instance_destroyed",
    "action_lifecycle_rejected",
    "binding_attached",
    "binding_detached",
    "binding_output",
    "binding_overlay",
    "binding_overlay_clear",
    "capability_input",
    "close_page",
    "open_page",
    "page_session_closed",
    "page_session_opened",
    "replace_page"
  ],
  "views": {
    "action_availability": {
      "keyPrefix": "views.b64_YWN0aW9uLXJ1bnRpbWUuY2xvY2stbWFpbg.action_availability.",
      "storeName": "deckr_action_runtime_service_view_v1",
      "writer": "service"
    }
  }
}
